{
  "version": 1,
  "title": "Example estate",
  "lede": "What example.test serves.",
  "issuer": "https://login.example.test",
  "replaceDefaults": true,
  "tierOrder": ["ops", "dev"],
  "entries": [
    {
      "name": "dash",
      "title": "Dashboards",
      "description": "Metrics, logs and traces.",
      "url": "https://dash.example.test/",
      "host": "dash.example.test",
      "tier": "ops",
      "requires": ["ops:viewer"],
      "runbook": "https://docs.example.test/dash"
    },
    {
      "name": "console",
      "title": "Console",
      "url": "https://console.dev.example.test/",
      "tier": "dev",
      "tailnet": true
    },
    {
      "name": "api.example.test",
      "title": "api.example.test",
      "url": "/api/",
      "tier": "dev",
      "catalog": true
    }
  ],
  "orientation": [{ "title": "Welcome", "body": "Start with the dashboards." }],
  "commandLine": [
    { "title": "Cluster", "body": "Reach the API.", "command": "kubectl get pods -A" }
  ],
  "guides": [
    { "title": "Docs", "links": [{ "title": "Handbook", "url": "https://docs.example.test/" }] }
  ]
}
